{
  "schema_id": "cartulary.frontend_source_ownership.v1",
  "source_root": "apps/web/src",
  "included_extensions": [
    ".ts",
    ".tsx"
  ],
  "entries": [
    {
      "owner_id": "web.app",
      "paths": [
        "apps/web/src/app/AccountApplicationMenu.test.tsx",
        "apps/web/src/app/AccountApplicationMenu.tsx",
        "apps/web/src/app/AccountDialog.tsx",
        "apps/web/src/app/AccountSecurityPanel.tsx",
        "apps/web/src/app/AccountSettingsDialog.tsx",
        "apps/web/src/app/AccountSettingsPanels.tsx",
        "apps/web/src/app/App.auth.support.test.tsx",
        "apps/web/src/app/App.auth.test.tsx",
        "apps/web/src/app/App.landing.test.tsx",
        "apps/web/src/app/App.timeline-invalidation.support.test.tsx",
        "apps/web/src/app/App.tsx",
        "apps/web/src/app/AppRoot.tsx",
        "apps/web/src/app/AppWorkflows.test.tsx",
        "apps/web/src/app/AppWorkflows.ts",
        "apps/web/src/app/AuthGateway.tsx",
        "apps/web/src/app/DeploymentAuditPanel.test.tsx",
        "apps/web/src/app/DeploymentAuditPanel.tsx",
        "apps/web/src/app/DeploymentUserActionDialog.tsx",
        "apps/web/src/app/DeploymentUserLeaveDialog.tsx",
        "apps/web/src/app/DeploymentUsersPanel.tsx",
        "apps/web/src/app/IncidentAdminPanel.test.tsx",
        "apps/web/src/app/IncidentAdminPanel.tsx",
        "apps/web/src/app/IncidentCreationForm.tsx",
        "apps/web/src/app/IncidentImportPanel.test.tsx",
        "apps/web/src/app/IncidentImportPanel.tsx",
        "apps/web/src/app/IncidentLanding.tsx",
        "apps/web/src/app/IncidentLifecyclePanel.tsx",
        "apps/web/src/app/IncidentMembershipAuditPanel.test.tsx",
        "apps/web/src/app/IncidentMembershipAuditPanel.tsx",
        "apps/web/src/app/IncidentMembershipManagementPanel.test.tsx",
        "apps/web/src/app/IncidentMembershipManagementPanel.tsx",
        "apps/web/src/app/IncidentMetadataPanel.tsx",
        "apps/web/src/app/LandingAdminDisplay.tsx",
        "apps/web/src/app/LandingAdminLayout.tsx",
        "apps/web/src/app/ReferencePackAdminPanel.test.tsx",
        "apps/web/src/app/ReferencePackAdminPanel.tsx",
        "apps/web/src/app/WorkbookPreferenceDepartureDialog.tsx",
        "apps/web/src/app/accountAuthenticationLifecycle.test.ts",
        "apps/web/src/app/accountFrontendBoundaries.test.tsx",
        "apps/web/src/app/accountInputValidation.ts",
        "apps/web/src/app/accountOperation.ts",
        "apps/web/src/app/accountPanelStyles.ts",
        "apps/web/src/app/accountSecurityModel.ts",
        "apps/web/src/app/accountSettingsEditing.test.tsx",
        "apps/web/src/app/accountSettingsModel.test.ts",
        "apps/web/src/app/accountSettingsModel.ts",
        "apps/web/src/app/administrativeAuditController.test.ts",
        "apps/web/src/app/administrativeAuditController.ts",
        "apps/web/src/app/administrativeAuditModel.test.ts",
        "apps/web/src/app/administrativeAuditModel.ts",
        "apps/web/src/app/api/administrativeAuditClient.test.ts",
        "apps/web/src/app/api/administrativeAuditClient.ts",
        "apps/web/src/app/api/authAccountClient.ts",
        "apps/web/src/app/api/deploymentUserClient.ts",
        "apps/web/src/app/api/incidentClient.ts",
        "apps/web/src/app/api/incidentDirectoryClient.test.ts",
        "apps/web/src/app/api/incidentImportClient.test.ts",
        "apps/web/src/app/api/incidentImportClient.ts",
        "apps/web/src/app/api/incidentLifecycleClient.test.ts",
        "apps/web/src/app/api/incidentLifecycleClient.ts",
        "apps/web/src/app/api/incidentMembershipAuditClient.test.ts",
        "apps/web/src/app/api/incidentMembershipAuditClient.ts",
        "apps/web/src/app/api/incidentMembershipManagementClient.test.ts",
        "apps/web/src/app/api/incidentMembershipManagementClient.ts",
        "apps/web/src/app/api/incidentMetadataClient.test.ts",
        "apps/web/src/app/api/incidentMetadataClient.ts",
        "apps/web/src/app/api/incidentMetadataContracts.ts",
        "apps/web/src/app/api/incidentResourceClient.ts",
        "apps/web/src/app/api/incidentResourceContracts.ts",
        "apps/web/src/app/api/publicHttpTypes.ts",
        "apps/web/src/app/api/shellHttpClients.routeBoundary.test.ts",
        "apps/web/src/app/appDepartureReview.test.ts",
        "apps/web/src/app/appDepartureReview.ts",
        "apps/web/src/app/appSessionController.test.tsx",
        "apps/web/src/app/appSessionController.ts",
        "apps/web/src/app/authenticationModel.ts",
        "apps/web/src/app/createIncidentLifecycleWorkflow.ts",
        "apps/web/src/app/createIncidentMembershipAuditWorkflow.ts",
        "apps/web/src/app/createIncidentMembershipManagementWorkflow.ts",
        "apps/web/src/app/createIncidentMetadataWorkflow.ts",
        "apps/web/src/app/createNetworkFlowImportWorkflow.ts",
        "apps/web/src/app/createReportingWorkflow.test.tsx",
        "apps/web/src/app/createReportingWorkflow.ts",
        "apps/web/src/app/createWorkbookImportWorkflow.ts",
        "apps/web/src/app/createWorkbookPreferencesWorkflow.ts",
        "apps/web/src/app/createWorkbookSavedViewsWorkflow.ts",
        "apps/web/src/app/createWorkflowPresentation.ts",
        "apps/web/src/app/deploymentUsersModel.test.ts",
        "apps/web/src/app/deploymentUsersModel.ts",
        "apps/web/src/app/fontBundle.test.ts",
        "apps/web/src/app/fontRoles.test.tsx",
        "apps/web/src/app/incidentCreationModel.test.ts",
        "apps/web/src/app/incidentCreationModel.ts",
        "apps/web/src/app/incidentDirectoryModel.test.ts",
        "apps/web/src/app/incidentDirectoryModel.ts",
        "apps/web/src/app/incidentImportHardening.test.ts",
        "apps/web/src/app/incidentImportModel.test.ts",
        "apps/web/src/app/incidentImportModel.ts",
        "apps/web/src/app/incidentImportState.test.ts",
        "apps/web/src/app/incidentImportState.ts",
        "apps/web/src/app/incidentLifecycleCharacterization.test.tsx",
        "apps/web/src/app/incidentLifecycleController.test.ts",
        "apps/web/src/app/incidentLifecycleController.ts",
        "apps/web/src/app/incidentLifecycleIntegration.test.tsx",
        "apps/web/src/app/incidentLifecycleModel.ts",
        "apps/web/src/app/incidentMembershipAuditCharacterization.test.tsx",
        "apps/web/src/app/incidentMembershipAuditController.test.ts",
        "apps/web/src/app/incidentMembershipAuditController.ts",
        "apps/web/src/app/incidentMembershipAuditLifecycle.test.tsx",
        "apps/web/src/app/incidentMembershipAuditModel.test.ts",
        "apps/web/src/app/incidentMembershipAuditModel.ts",
        "apps/web/src/app/incidentMembershipManagementCharacterization.test.tsx",
        "apps/web/src/app/incidentMembershipManagementController.test.ts",
        "apps/web/src/app/incidentMembershipManagementController.ts",
        "apps/web/src/app/incidentMembershipManagementLifecycle.test.tsx",
        "apps/web/src/app/incidentMembershipManagementModel.ts",
        "apps/web/src/app/incidentMetadataCharacterization.test.tsx",
        "apps/web/src/app/incidentMetadataController.test.ts",
        "apps/web/src/app/incidentMetadataController.ts",
        "apps/web/src/app/incidentMetadataLifecycle.test.tsx",
        "apps/web/src/app/incidentMetadataModel.ts",
        "apps/web/src/app/incidentResourceController.ts",
        "apps/web/src/app/landingAdminStyles.ts",
        "apps/web/src/app/landingAdminTypes.ts",
        "apps/web/src/app/otelBoundary.test.ts",
        "apps/web/src/app/referencePackAdminController.test.ts",
        "apps/web/src/app/referencePackAdminController.ts",
        "apps/web/src/app/referencePackAdminModel.test.ts",
        "apps/web/src/app/referencePackAdminModel.ts",
        "apps/web/src/app/routeState.test.ts",
        "apps/web/src/app/routeState.ts",
        "apps/web/src/app/useAccountMenuLayout.ts",
        "apps/web/src/app/useAccountSecurity.ts",
        "apps/web/src/app/useAdministrativeAudit.ts",
        "apps/web/src/app/useAppRouteRuntime.ts",
        "apps/web/src/app/useAppSession.ts",
        "apps/web/src/app/useAppWorkflows.ts",
        "apps/web/src/app/useAuthentication.ts",
        "apps/web/src/app/useDeploymentUsers.ts",
        "apps/web/src/app/useIncidentCreation.ts",
        "apps/web/src/app/useIncidentDirectory.ts",
        "apps/web/src/app/useIncidentImport.ts",
        "apps/web/src/app/useNetworkFlowImport.test.tsx",
        "apps/web/src/app/useReferencePackAdmin.ts",
        "apps/web/src/app/useWorkbookImport.test.tsx",
        "apps/web/src/app/workbookPreferenceIntegration.test.tsx"
      ]
    },
    {
      "owner_id": "web.collaboration",
      "paths": [
        "apps/web/src/collaboration/IncidentCollaborationSession.test.tsx",
        "apps/web/src/collaboration/IncidentCollaborationSession.tsx",
        "apps/web/src/collaboration/incidentCollaborationSessionPlan.test.ts",
        "apps/web/src/collaboration/incidentCollaborationSessionPlan.ts"
      ]
    },
    {
      "owner_id": "web.entry",
      "paths": [
        "apps/web/src/main.tsx"
      ]
    },
    {
      "owner_id": "web.extensions",
      "paths": [
        "apps/web/src/extensions/ExtensionAvailabilityContext.tsx",
        "apps/web/src/extensions/extensionAvailability.test.ts",
        "apps/web/src/extensions/extensionAvailability.ts",
        "apps/web/src/extensions/extensionWorkspaceIdentities.ts"
      ]
    },
    {
      "owner_id": "web.imports",
      "paths": [
        "apps/web/src/imports/WorkbookImportController.test.ts",
        "apps/web/src/imports/WorkbookImportController.ts",
        "apps/web/src/imports/importCoordinator.test.ts",
        "apps/web/src/imports/importCoordinator.ts",
        "apps/web/src/imports/importJobObservation.test.ts",
        "apps/web/src/imports/importRequests.ts",
        "apps/web/src/imports/workbookImportBinding.ts",
        "apps/web/src/imports/workbookImportMapping.ts",